{
  "$schema": "https://json-schema.org/draft/2020-12/schema",
  "type": "object",
  "properties": {
    "bt_run_id": {
      "type": "string"
    },
    "split": {
      "type": "string"
    },
    "candidate": {
      "type": "string"
    },
    "bin": {
      "type": "integer",
      "minimum": -2147483648,
      "maximum": 2147483647
    },
    "p_mean": {
      "type": "number",
      "minimum": 0,
      "maximum": 1
    },
    "y_mean": {
      "type": "number",
      "minimum": 0,
      "maximum": 1
    },
    "n": {
      "type": "integer",
      "minimum": -2147483648,
      "maximum": 2147483647
    }
  },
  "required": [
    "bt_run_id",
    "split",
    "candidate",
    "bin",
    "p_mean",
    "y_mean",
    "n"
  ],
  "additionalProperties": false
}
