[{"bt_run_id":"nfl_games_v1:7244a0bc8ac6","split":"confirm","candidate":"B1[C1]","bin":1,"p_mean":0.22834138584386,"y_mean":0.263157894736842,"n":57},{"bt_run_id":"nfl_games_v1:7244a0bc8ac6","split":"confirm","candidate":"B1[C1]","bin":2,"p_mean":0.340162628568421,"y_mean":0.263157894736842,"n":57},{"bt_run_id":"nfl_games_v1:7244a0bc8ac6","split":"confirm","candidate":"B1[C1]","bin":3,"p_mean":0.400047646936842,"y_mean":0.315789473684211,"n":57},{"bt_run_id":"nfl_games_v1:7244a0bc8ac6","split":"confirm","candidate":"B1[C1]","bin":4,"p_mean":0.460634786675439,"y_mean":0.473684210526316,"n":57},{"bt_run_id":"nfl_games_v1:7244a0bc8ac6","split":"confirm","candidate":"B1[C1]","bin":5,"p_mean":0.535228370480702,"y_mean":0.578947368421053,"n":57},{"bt_run_id":"nfl_games_v1:7244a0bc8ac6","split":"confirm","candidate":"B1[C1]","bin":6,"p_mean":0.580955163773684,"y_mean":0.649122807017544,"n":57},{"bt_run_id":"nfl_games_v1:7244a0bc8ac6","split":"confirm","candidate":"B1[C1]","bin":7,"p_mean":0.624618019652632,"y_mean":0.719298245614035,"n":57},{"bt_run_id":"nfl_games_v1:7244a0bc8ac6","split":"confirm","candidate":"B1[C1]","bin":8,"p_mean":0.686700302654386,"y_mean":0.754385964912281,"n":57},{"bt_run_id":"nfl_games_v1:7244a0bc8ac6","split":"confirm","candidate":"B1[C1]","bin":9,"p_mean":0.747797020107018,"y_mean":0.684210526315789,"n":57},{"bt_run_id":"nfl_games_v1:7244a0bc8ac6","split":"confirm","candidate":"B1[C1]","bin":10,"p_mean":0.83515013697193,"y_mean":0.859649122807018,"n":57},{"bt_run_id":"nfl_games_v1:7244a0bc8ac6","split":"confirm","candidate":"B1[C2]","bin":1,"p_mean":0.233080096064912,"y_mean":0.263157894736842,"n":57},{"bt_run_id":"nfl_games_v1:7244a0bc8ac6","split":"confirm","candidate":"B1[C2]","bin":2,"p_mean":0.344307646196491,"y_mean":0.245614035087719,"n":57},{"bt_run_id":"nfl_games_v1:7244a0bc8ac6","split":"confirm","candidate":"B1[C2]","bin":3,"p_mean":0.40215200982807,"y_mean":0.333333333333333,"n":57},{"bt_run_id":"nfl_games_v1:7244a0bc8ac6","split":"confirm","candidate":"B1[C2]","bin":4,"p_mean":0.461613754210526,"y_mean":0.491228070175439,"n":57},{"bt_run_id":"nfl_games_v1:7244a0bc8ac6","split":"confirm","candidate":"B1[C2]","bin":5,"p_mean":0.536563763529825,"y_mean":0.578947368421053,"n":57},{"bt_run_id":"nfl_games_v1:7244a0bc8ac6","split":"confirm","candidate":"B1[C2]","bin":6,"p_mean":0.579811751617544,"y_mean":0.631578947368421,"n":57},{"bt_run_id":"nfl_games_v1:7244a0bc8ac6","split":"confirm","candidate":"B1[C2]","bin":7,"p_mean":0.622618871633333,"y_mean":0.719298245614035,"n":57},{"bt_run_id":"nfl_games_v1:7244a0bc8ac6","split":"confirm","candidate":"B1[C2]","bin":8,"p_mean":0.682852998880702,"y_mean":0.736842105263158,"n":57},{"bt_run_id":"nfl_games_v1:7244a0bc8ac6","split":"confirm","candidate":"B1[C2]","bin":9,"p_mean":0.743836935157895,"y_mean":0.719298245614035,"n":57},{"bt_run_id":"nfl_games_v1:7244a0bc8ac6","split":"confirm","candidate":"B1[C2]","bin":10,"p_mean":0.831339203396491,"y_mean":0.842105263157895,"n":57},{"bt_run_id":"nfl_games_v1:7244a0bc8ac6","split":"confirm","candidate":"B1[E1]","bin":1,"p_mean":0.228108416208772,"y_mean":0.263157894736842,"n":57},{"bt_run_id":"nfl_games_v1:7244a0bc8ac6","split":"confirm","candidate":"B1[E1]","bin":2,"p_mean":0.340313907119298,"y_mean":0.263157894736842,"n":57},{"bt_run_id":"nfl_games_v1:7244a0bc8ac6","split":"confirm","candidate":"B1[E1]","bin":3,"p_mean":0.398338422798246,"y_mean":0.333333333333333,"n":57},{"bt_run_id":"nfl_games_v1:7244a0bc8ac6","split":"confirm","candidate":"B1[E1]","bin":4,"p_mean":0.459024937549123,"y_mean":0.473684210526316,"n":57},{"bt_run_id":"nfl_games_v1:7244a0bc8ac6","split":"confirm","candidate":"B1[E1]","bin":5,"p_mean":0.536627055342105,"y_mean":0.578947368421053,"n":57},{"bt_run_id":"nfl_games_v1:7244a0bc8ac6","split":"confirm","candidate":"B1[E1]","bin":6,"p_mean":0.580226908164912,"y_mean":0.649122807017544,"n":57},{"bt_run_id":"nfl_games_v1:7244a0bc8ac6","split":"confirm","candidate":"B1[E1]","bin":7,"p_mean":0.6238614975,"y_mean":0.719298245614035,"n":57},{"bt_run_id":"nfl_games_v1:7244a0bc8ac6","split":"confirm","candidate":"B1[E1]","bin":8,"p_mean":0.68473599278421,"y_mean":0.736842105263158,"n":57},{"bt_run_id":"nfl_games_v1:7244a0bc8ac6","split":"confirm","candidate":"B1[E1]","bin":9,"p_mean":0.74729773355614,"y_mean":0.701754385964912,"n":57},{"bt_run_id":"nfl_games_v1:7244a0bc8ac6","split":"confirm","candidate":"B1[E1]","bin":10,"p_mean":0.834911692745614,"y_mean":0.842105263157895,"n":57},{"bt_run_id":"nfl_games_v1:7244a0bc8ac6","split":"confirm","candidate":"B2[E1]","bin":1,"p_mean":0.250443824624561,"y_mean":0.245614035087719,"n":57},{"bt_run_id":"nfl_games_v1:7244a0bc8ac6","split":"confirm","candidate":"B2[E1]","bin":2,"p_mean":0.360060455438596,"y_mean":0.280701754385965,"n":57},{"bt_run_id":"nfl_games_v1:7244a0bc8ac6","split":"confirm","candidate":"B2[E1]","bin":3,"p_mean":0.417685901768421,"y_mean":0.315789473684211,"n":57},{"bt_run_id":"nfl_games_v1:7244a0bc8ac6","split":"confirm","candidate":"B2[E1]","bin":4,"p_mean":0.474356774819298,"y_mean":0.473684210526316,"n":57},{"bt_run_id":"nfl_games_v1:7244a0bc8ac6","split":"confirm","candidate":"B2[E1]","bin":5,"p_mean":0.54382880832807,"y_mean":0.631578947368421,"n":57},{"bt_run_id":"nfl_games_v1:7244a0bc8ac6","split":"confirm","candidate":"B2[E1]","bin":6,"p_mean":0.58645259115614,"y_mean":0.614035087719298,"n":57},{"bt_run_id":"nfl_games_v1:7244a0bc8ac6","split":"confirm","candidate":"B2[E1]","bin":7,"p_mean":0.627468881682456,"y_mean":0.701754385964912,"n":57},{"bt_run_id":"nfl_games_v1:7244a0bc8ac6","split":"confirm","candidate":"B2[E1]","bin":8,"p_mean":0.685230612454386,"y_mean":0.754385964912281,"n":57},{"bt_run_id":"nfl_games_v1:7244a0bc8ac6","split":"confirm","candidate":"B2[E1]","bin":9,"p_mean":0.742948358733333,"y_mean":0.684210526315789,"n":57},{"bt_run_id":"nfl_games_v1:7244a0bc8ac6","split":"confirm","candidate":"B2[E1]","bin":10,"p_mean":0.826511387196491,"y_mean":0.859649122807018,"n":57},{"bt_run_id":"nfl_games_v1:7244a0bc8ac6","split":"confirm","candidate":"C0","bin":1,"p_mean":0.247338784347368,"y_mean":0.245614035087719,"n":57},{"bt_run_id":"nfl_games_v1:7244a0bc8ac6","split":"confirm","candidate":"C0","bin":2,"p_mean":0.358554822131579,"y_mean":0.245614035087719,"n":57},{"bt_run_id":"nfl_games_v1:7244a0bc8ac6","split":"confirm","candidate":"C0","bin":3,"p_mean":0.415175645403509,"y_mean":0.350877192982456,"n":57},{"bt_run_id":"nfl_games_v1:7244a0bc8ac6","split":"confirm","candidate":"C0","bin":4,"p_mean":0.472525150549123,"y_mean":0.491228070175439,"n":57},{"bt_run_id":"nfl_games_v1:7244a0bc8ac6","split":"confirm","candidate":"C0","bin":5,"p_mean":0.54553753365614,"y_mean":0.578947368421053,"n":57},{"bt_run_id":"nfl_games_v1:7244a0bc8ac6","split":"confirm","candidate":"C0","bin":6,"p_mean":0.586760866236842,"y_mean":0.631578947368421,"n":57},{"bt_run_id":"nfl_games_v1:7244a0bc8ac6","split":"confirm","candidate":"C0","bin":7,"p_mean":0.628456283175439,"y_mean":0.719298245614035,"n":57},{"bt_run_id":"nfl_games_v1:7244a0bc8ac6","split":"confirm","candidate":"C0","bin":8,"p_mean":0.685862679633333,"y_mean":0.754385964912281,"n":57},{"bt_run_id":"nfl_games_v1:7244a0bc8ac6","split":"confirm","candidate":"C0","bin":9,"p_mean":0.74490256902807,"y_mean":0.666666666666667,"n":57},{"bt_run_id":"nfl_games_v1:7244a0bc8ac6","split":"confirm","candidate":"C0","bin":10,"p_mean":0.828962867647368,"y_mean":0.87719298245614,"n":57},{"bt_run_id":"nfl_games_v1:7244a0bc8ac6","split":"confirm","candidate":"C1","bin":1,"p_mean":0.268823469452632,"y_mean":0.333333333333333,"n":57},{"bt_run_id":"nfl_games_v1:7244a0bc8ac6","split":"confirm","candidate":"C1","bin":2,"p_mean":0.37544623192807,"y_mean":0.403508771929825,"n":57},{"bt_run_id":"nfl_games_v1:7244a0bc8ac6","split":"confirm","candidate":"C1","bin":3,"p_mean":0.427036410214035,"y_mean":0.368421052631579,"n":57},{"bt_run_id":"nfl_games_v1:7244a0bc8ac6","split":"confirm","candidate":"C1","bin":4,"p_mean":0.47584237827193,"y_mean":0.421052631578947,"n":57},{"bt_run_id":"nfl_games_v1:7244a0bc8ac6","split":"confirm","candidate":"C1","bin":5,"p_mean":0.522219788589474,"y_mean":0.473684210526316,"n":57},{"bt_run_id":"nfl_games_v1:7244a0bc8ac6","split":"confirm","candidate":"C1","bin":6,"p_mean":0.568735615794737,"y_mean":0.631578947368421,"n":57},{"bt_run_id":"nfl_games_v1:7244a0bc8ac6","split":"confirm","candidate":"C1","bin":7,"p_mean":0.611557769008772,"y_mean":0.684210526315789,"n":57},{"bt_run_id":"nfl_games_v1:7244a0bc8ac6","split":"confirm","candidate":"C1","bin":8,"p_mean":0.661838662642105,"y_mean":0.684210526315789,"n":57},{"bt_run_id":"nfl_games_v1:7244a0bc8ac6","split":"confirm","candidate":"C1","bin":9,"p_mean":0.712462835694737,"y_mean":0.771929824561403,"n":57},{"bt_run_id":"nfl_games_v1:7244a0bc8ac6","split":"confirm","candidate":"C1","bin":10,"p_mean":0.796261275877193,"y_mean":0.789473684210526,"n":57},{"bt_run_id":"nfl_games_v1:7244a0bc8ac6","split":"confirm","candidate":"C2","bin":1,"p_mean":0.269626006638596,"y_mean":0.350877192982456,"n":57},{"bt_run_id":"nfl_games_v1:7244a0bc8ac6","split":"confirm","candidate":"C2","bin":2,"p_mean":0.381481499880702,"y_mean":0.263157894736842,"n":57},{"bt_run_id":"nfl_games_v1:7244a0bc8ac6","split":"confirm","candidate":"C2","bin":3,"p_mean":0.44284166875614,"y_mean":0.368421052631579,"n":57},{"bt_run_id":"nfl_games_v1:7244a0bc8ac6","split":"confirm","candidate":"C2","bin":4,"p_mean":0.490883633435088,"y_mean":0.56140350877193,"n":57},{"bt_run_id":"nfl_games_v1:7244a0bc8ac6","split":"confirm","candidate":"C2","bin":5,"p_mean":0.542027708870175,"y_mean":0.578947368421053,"n":57},{"bt_run_id":"nfl_games_v1:7244a0bc8ac6","split":"confirm","candidate":"C2","bin":6,"p_mean":0.594455539321053,"y_mean":0.56140350877193,"n":57},{"bt_run_id":"nfl_games_v1:7244a0bc8ac6","split":"confirm","candidate":"C2","bin":7,"p_mean":0.637574957282456,"y_mean":0.596491228070175,"n":57},{"bt_run_id":"nfl_games_v1:7244a0bc8ac6","split":"confirm","candidate":